{
  "$schema": "https://json-schema.org/draft/2020-12/schema",
  "$id": "https://ww.cx/schemas/outbound-mail-prepare-request.schema.json",
  "title": "WW.CX Outbound Mail Preparation Request",
  "type": "object",
  "additionalProperties": false,
  "required": [
    "to",
    "subject",
    "body",
    "message_class",
    "signer_name",
    "signer_title",
    "mailing_address"
  ],
  "properties": {
    "from_address": {
      "type": "string",
      "format": "email",
      "description": "Optional submitted sender metadata. The canonical identity registry may replace it; it cannot override automatic sender selection."
    },
    "to": {
      "$ref": "#/$defs/addressList"
    },
    "cc": {
      "$ref": "#/$defs/addressList"
    },
    "bcc": {
      "$ref": "#/$defs/addressList"
    },
    "subject": {
      "type": "string",
      "minLength": 1,
      "maxLength": 998
    },
    "body": {
      "type": "string",
      "minLength": 1
    },
    "message_class": {
      "enum": [
        "business_correspondence",
        "support",
        "legal_notice",
        "commercial"
      ]
    },
    "signer_name": {
      "type": "string",
      "minLength": 1,
      "maxLength": 160
    },
    "signer_title": {
      "type": "string",
      "minLength": 1,
      "maxLength": 160
    },
    "case_id": {
      "type": "string",
      "pattern": "^[A-Z0-9][A-Z0-9._:-]{5,127}$"
    },
    "action_id": {
      "type": "string",
      "pattern": "^[A-Z0-9][A-Z0-9._:-]{5,127}$"
    },
    "control_id": {
      "type": "string",
      "pattern": "^[A-Z0-9][A-Z0-9._:-]{5,127}$"
    },
    "correspondence_id": {
      "type": "string",
      "pattern": "^[A-Z0-9][A-Z0-9._:-]{5,127}$",
      "description": "Stable WW.CX correspondence identifier supplied by trusted intake or workflow state."
    },
    "thread_id": {
      "type": "string",
      "pattern": "^[A-Z0-9][A-Z0-9._:-]{5,127}$",
      "description": "Stable WW.CX thread identifier; never inferred from untrusted subject text alone."
    },
    "source_message_id": {
      "$ref": "#/$defs/messageId"
    },
    "in_reply_to": {
      "$ref": "#/$defs/messageId"
    },
    "references": {
      "type": "array",
      "maxItems": 100,
      "uniqueItems": true,
      "items": {
        "$ref": "#/$defs/messageId"
      }
    },
    "provider_thread_id": {
      "type": "string",
      "minLength": 1,
      "maxLength": 512,
      "description": "Opaque provider conversation/thread identifier retained as internal metadata only."
    },
    "provider_message_id": {
      "type": "string",
      "minLength": 1,
      "maxLength": 512,
      "description": "Opaque provider message identifier retained as internal metadata only."
    },
    "unsubscribe_url": {
      "type": "string",
      "format": "uri",
      "pattern": "^https://"
    },
    "mailing_address": {
      "type": "string",
      "minLength": 1,
      "maxLength": 500
    },
    "reply_to": {
      "type": "string",
      "format": "email"
    },
    "identity_hint": {
      "type": "string",
      "minLength": 1,
      "maxLength": 160,
      "description": "Canonical sender-profile key or registered sender address."
    },
    "original_recipient": {
      "type": "string",
      "format": "email",
      "description": "Original managed address that received the correspondence being answered."
    },
    "system_generated": {
      "type": "boolean",
      "default": false,
      "description": "Selects the reserved noreply identity; manual hints cannot select noreply."
    }
  },
  "$defs": {
    "addressList": {
      "type": "array",
      "maxItems": 50,
      "uniqueItems": true,
      "items": {
        "type": "string",
        "format": "email"
      }
    },
    "messageId": {
      "type": "string",
      "maxLength": 998,
      "pattern": "^<[^<>\\r\\n\\s]+@[^<>\\r\\n\\s]+>$"
    }
  }
}
